{
  "schemaVersion": 1,
  "evidence": "measured",
  "runId": "astra-3",
  "executedAt": "2026-09-12T23:05:46.692Z",
  "executor": {
    "provider": "codex-collaboration",
    "model": "gpt-6-astra",
    "modelVersion": "gpt-6-astra",
    "settings": {
      "reasoningEffort": "medium",
      "temperature": "not exposed",
      "seed": "not exposed",
      "isolation": "fork_turns:none",
      "modelSnapshot": "runtime alias only; underlying build not exposed",
      "protocolPath": "ai-regressions/results/2026-09-13/protocol.md",
      "protocolSha256": "ac4f8ecef44f0e11c2b93d19b861ee6596417c92ff58d26a9d3f3953cd01bd53",
      "recordedAtMeaning": "cohort completion and scoring time; executions occurred immediately beforehand"
    },
    "isolationUnit": "condition",
    "conditionSessions": {
      "none": "/root/astra_0913_3_none",
      "current-guidance": "/root/astra_0913_3_current",
      "revised-recipes-catalog": "/root/astra_0913_3_revised"
    }
  },
  "harness": {
    "baseRevision": "828a56ab40f9b5d6688798a239cc9b3f996f3dc8",
    "corpusSha256": "67dae8d51bdc22e543cb1585b0c10a620d305e9a2072e6b18b0f32a3d520bbe2",
    "conditionsSha256": "9937a77f7dffb0b9d2c77d7c99c17943cbaff5557c8d05c1ec9ad0a81d9988d1",
    "catalogSha256": "87613e020c97806c82d6758b1559c30c6f6463f57acc5eb85e0d42b245458cd4",
    "scorerSha256": "3abcb4b450067d744c5756b43fbefe2ced9bd35c0c34d3f9b83e18dc659e1768",
    "catalogSchemaSha256": "9e3f993a8dd58c925393a2a4ad1d214758e44ba2e244652dceca56f7970375f7",
    "corpusSchemaSha256": "1fe3ee346d47f3377eefda3401dc3014e55ac8aedcdf492c9aec1a58d2f4864b",
    "conditionsSchemaSha256": "fb0ad7cba018ccd5bc53e84463a368dcf374edf5f59dba3590ee2b61e6cfe6ad",
    "responseSchemaSha256": "dcc480e86aeb2c7acb9a4812b16f1e53a3884328ccd3602c2944918dbba283cd",
    "runSchemaSha256": "75c1398ca2f5395e537e50304f891d4b2b36ce40050749a23a8f7b589baf8282",
    "typescriptVersion": "6.0.3"
  },
  "conditions": [
    {
      "id": "none",
      "sourceRevision": null,
      "sha256": "e3b0c44298fc1c149afbf4c8996fb92427ae41e4649b934ca495991b7852b855",
      "sources": []
    },
    {
      "id": "current-guidance",
      "sourceRevision": "4ed4515fb372cf4dc45325452fa4347bdaa080b0",
      "sha256": "f13d7863d973c0290f0636fec9a2889dbd7e2800a39d49725f0d363847500659",
      "sources": [
        {
          "path": "ai-regressions/contexts/current-guidance-4ed4515.md",
          "sha256": "976b0e9c41cf251804107bbe2d7024d8734da7d58dfe9efed1dbd6ce24b64d28"
        }
      ]
    },
    {
      "id": "revised-recipes-catalog",
      "sourceRevision": null,
      "sha256": "f3cd2e13c1fb516a1f69f108825b487ac9ad65e64ac67ef31200c3278e783816",
      "sources": [
        {
          "path": "ai/skill.md",
          "sha256": "2cf3a193face347793893f86b8b1a1f95cde36db950d24c271173a385eafa823"
        },
        {
          "path": "docs/component-selection.md",
          "sha256": "6755b3afe750d58ee350b884732f4330aa2b646a549859ad83009223316441cf"
        },
        {
          "path": "docs/layout.md",
          "sha256": "df4f8ad4b25ef6320c92141ce78feb5a69788eefcea9cc050e9dd1c01994edba"
        },
        {
          "path": "docs/accessibility.md",
          "sha256": "8e162a6fe84c19e5d43d3cf292f7024f12574c98e86a7c328652121799112793"
        },
        {
          "path": "ai/component-catalog.json",
          "sha256": "87613e020c97806c82d6758b1559c30c6f6463f57acc5eb85e0d42b245458cd4"
        },
        {
          "path": "docs/recipes.md",
          "sha256": "ce45a20b4df078e5c0c371b20f3e44eee8d9ced526748c909e5f3c8a850db67f"
        },
        {
          "path": "ux-demo/recipes/app-shell.tsx",
          "sha256": "5b04b597ee195056a97864e075c341b39f1dc6aba4368c366fe18eca0162a3b1"
        },
        {
          "path": "ux-demo/recipes/navigation-sidebar.tsx",
          "sha256": "a878f36a4e707da64dca4631963815bfe139146a3829c453ab7db9153ac628a9"
        },
        {
          "path": "ux-demo/recipes/workspace-header.tsx",
          "sha256": "c4fe7e00970db9aba5fb9e25442284620968e4cbed29c577ef4a14ab699f3f54"
        },
        {
          "path": "ux-demo/recipes/master-detail-dialog.tsx",
          "sha256": "5011bd7a931094ea6578613d64e477373659069f27907fc26c0c51fdf0af2938"
        },
        {
          "path": "ux-demo/recipes/composer-form.tsx",
          "sha256": "0075e8acc46a9d56a8738b20c57975e809535b9a89724c207f1510af50e93b8a"
        },
        {
          "path": "ux-demo/recipes/list-workspace-states.tsx",
          "sha256": "3bdb46d5bb9993bed277b89cb9f92884ef1054ff40a6fafa510bac2a21625e59"
        },
        {
          "path": "ux-demo/recipes/compact-toolbar.tsx",
          "sha256": "946907c1ee94c7aa4036e79bf25ffc68881cbcf66f4809138f1aa5b58af6e3fb"
        },
        {
          "path": "ux-demo/recipes/recipes.css",
          "sha256": "144fafe77ea4baf8eb09ccf1827621a8aa1a91b1b35a02fb797ed4c6897cb7a9"
        }
      ]
    }
  ],
  "results": [
    {
      "caseId": "application-shell",
      "condition": "none",
      "sessionId": "/root/astra_0913_3_none",
      "requestOrdinal": 1,
      "promptSha256": "bffe7198bd365739e33c5108001be4a368818001a268de3ec1d0ce29d6a796a6",
      "contextSha256": "e3b0c44298fc1c149afbf4c8996fb92427ae41e4649b934ca495991b7852b855",
      "responsePath": "ai-regressions/results/2026-09-13/astra-3/none/application-shell.json",
      "responseSha256": "2a16159b30818aecef9498d21b81580dcbecfa8fca510dc5a1e9d92f3cf2aa93",
      "score": {
        "caseId": "application-shell",
        "pass": false,
        "dimensions": {
          "reuse": false,
          "wiring": false,
          "layout": false,
          "accessibility": true,
          "escalation": true
        },
        "checks": [
          {
            "code": "source:parse",
            "pass": true,
            "detail": "TypeScript and TSX parse without syntax errors"
          },
          {
            "code": "import:@kerfjs/ui/toolbar",
            "pass": false,
            "detail": "imports @kerfjs/ui/toolbar"
          },
          {
            "code": "import:@kerfjs/ui/menu-header",
            "pass": false,
            "detail": "imports @kerfjs/ui/menu-header"
          },
          {
            "code": "import:@kerfjs/ui/menu-item",
            "pass": false,
            "detail": "imports @kerfjs/ui/menu-item"
          },
          {
            "code": "import:@kerfjs/ui/resizable-region",
            "pass": false,
            "detail": "imports @kerfjs/ui/resizable-region"
          },
          {
            "code": "import:@kerfjs/ui/layout.css",
            "pass": false,
            "detail": "imports @kerfjs/ui/layout.css"
          },
          {
            "code": "import:@kerfjs/ui/sidebar.css",
            "pass": false,
            "detail": "imports @kerfjs/ui/sidebar.css"
          },
          {
            "code": "component:toolbar",
            "pass": false,
            "detail": "uses toolbar through an imported invocation, not a copied class name"
          },
          {
            "code": "component:menu-header",
            "pass": false,
            "detail": "uses menu-header through an imported invocation, not a copied class name"
          },
          {
            "code": "component:menu-item",
            "pass": false,
            "detail": "uses menu-item through an imported invocation, not a copied class name"
          },
          {
            "code": "component:resize",
            "pass": false,
            "detail": "uses resize through an imported invocation, not a copied class name"
          },
          {
            "code": "component:layout",
            "pass": true,
            "detail": "uses layout through an imported invocation, not a copied class name"
          },
          {
            "code": "component:menu",
            "pass": true,
            "detail": "uses menu through an imported invocation, not a copied class name"
          },
          {
            "code": "avoid:wa-split-panel",
            "pass": true,
            "detail": "does not substitute wa-split-panel"
          },
          {
            "code": "class:kui-layout",
            "pass": false,
            "detail": "uses semantic class kui-layout"
          },
          {
            "code": "class:kui-sidebar",
            "pass": false,
            "detail": "uses semantic class kui-sidebar"
          },
          {
            "code": "class:kui-scroll-owner",
            "pass": false,
            "detail": "uses semantic class kui-scroll-owner"
          },
          {
            "code": "wiring:wireResizableRegions",
            "pass": false,
            "detail": "calls wireResizableRegions from @kerfjs/ui/resizable-region and retains its disposer/result"
          },
          {
            "code": "duplicate:menu-row-copy",
            "pass": true,
            "detail": "does not introduce menu-row-copy"
          },
          {
            "code": "duplicate:resize-handle-copy",
            "pass": true,
            "detail": "does not introduce resize-handle-copy"
          },
          {
            "code": "layout:scroll-owners",
            "pass": true,
            "detail": "declares 0; maximum 3"
          },
          {
            "code": "layout:single-inset-owner",
            "pass": true,
            "detail": "each element has at most one semantic inset owner"
          },
          {
            "code": "css:public-boundary",
            "pass": true,
            "detail": "does not reach through a Kerf component root"
          },
          {
            "code": "css:semantic-spacing",
            "pass": false,
            "detail": "hard-coded spacing: gap:16px, padding:8px 16px, padding:16px, padding:10px, gap:8px, margin-bottom:20px, padding:8px, gap:4px"
          },
          {
            "code": "a11y:named-buttons",
            "pass": true,
            "detail": "native buttons have text or an accessible name"
          }
        ]